{"audit_requirements":{"receipt_schema_member_id":"member:receipt_schema","record_agents":true,"record_objective":true,"record_results":true,"record_route":true},"content_members":[{"content":"Resultado X a revisar.","digest":"sha256:44d90d18d91d79fbae7e1ca43c47a1657f6e0a644e9fe9ae63119f79c2f20186","encoding":"utf-8","kind":"input","media_type":"text/plain","member_id":"member:result_x"},{"content":"{\"type\":\"object\",\"required\":[\"findings\"],\"properties\":{\"findings\":{\"type\":\"array\",\"items\":{\"type\":\"string\"}}},\"additionalProperties\":false}","digest":"sha256:40184ddadfbe797e460872fb8c0040d10257528fba1aed3aee885724f649bb60","encoding":"utf-8","kind":"schema","media_type":"application/schema+json","member_id":"member:review_report_schema"},{"content":"{\"type\":\"object\",\"required\":[\"patch\",\"coverage\"],\"properties\":{\"patch\":{\"type\":\"string\"},\"coverage\":{\"type\":\"array\",\"items\":{\"type\":\"string\"}}},\"additionalProperties\":false}","digest":"sha256:a01c7539a622acae730428c7f54ed0e4c75e37019ad5d8ae8520c19c3a3074c2","encoding":"utf-8","kind":"schema","media_type":"application/schema+json","member_id":"member:correction_schema"},{"content":"{\"type\":\"object\",\"required\":[\"verdict\",\"evidence\"],\"properties\":{\"verdict\":{\"enum\":[\"pass\",\"flag\",\"block\"]},\"evidence\":{\"type\":\"array\",\"items\":{\"type\":\"string\"}}},\"additionalProperties\":false}","digest":"sha256:eaac2832bf0c48808dcbb30a218d607b3079e8ccbcea5948b3b48431f31c2ef5","encoding":"utf-8","kind":"schema","media_type":"application/schema+json","member_id":"member:verification_schema"},{"content":"{\"type\":\"object\",\"required\":[\"status\"],\"properties\":{\"status\":{\"enum\":[\"pass\",\"flag\",\"block\"]}},\"additionalProperties\":false}","digest":"sha256:afcdfaaae32fc49c8b207158547b6b2cf34606f165350fe3fd165c3683d6ad38","encoding":"utf-8","kind":"schema","media_type":"application/schema+json","member_id":"member:receipt_schema"}],"dispatch_id":"dispatch:aci.fixture:review_correct_verify","edges":[{"condition":"on_success","edge_id":"edge:review:correct:data","from_node_id":"node:review","kind":"data","to_node_id":"node:correct"},{"condition":"on_success","edge_id":"edge:review:verify:data","from_node_id":"node:review","kind":"data","to_node_id":"node:verify"},{"condition":"on_success","edge_id":"edge:correct:verify:data","from_node_id":"node:correct","kind":"data","to_node_id":"node:verify"}],"global_limits":{"max_attempts":5,"max_tokens":24000,"wall_clock_seconds":1200},"lifecycle":{"cancellation":"cancel_running_nodes","completion":"all_terminal_succeeded","entry_nodes":["node:review"],"failure":"fail_fast","max_parallel_nodes":1,"terminal_nodes":["node:verify"]},"nodes":[{"agent":{"credential_ref":null,"display_name":"Popper, Karl","model_ref":{"digest":"sha256:951a0d328e2112a4598601c50024b75eeb9bffd06cbac9e593324567789d80f4","name":"gpt-5.6","version":"2026-09"},"profile_ref":{"digest":"sha256:301a4279e233a7ed845a72eb00b94c56c6cbae13a56c7cf7ff29b8c0bffa1b91","name":"aci.read-only-reviewer","version":"1"},"provider_ref":{"digest":"sha256:6444659beabb3dbdf99bb59782d8b67035b779e175a8b83e6dfffba3722fdd63","name":"openai","version":"2026-09"},"role":"skeptic"},"inputs":[{"input_id":"input:target","required":true,"source":{"kind":"content_member","member_id":"member:result_x","selector":"$"}}],"instructions":"Revise somente o resultado X fornecido. Liste defeitos com evidência e critérios objetivos para a correção. Não altere arquivos.","isolation":{"commands":{"grants":[],"mode":"deny"},"external_effects":{"allow":[],"mode":"deny"},"network":{"allow":[],"mode":"deny"},"read_paths":["workspace:/input/result-x"],"version_control":{"commit":false,"push":false},"write_paths":[]},"limits":{"max_attempts":1,"max_tokens":6000,"wall_clock_seconds":300},"node_id":"node:review","objective":"Encontrar defeitos verificáveis no resultado X.","outputs":[{"output_id":"output:review_report","required":true,"schema_member_id":"member:review_report_schema"}],"start_when":"roots_ready","stop_conditions":[{"action":"stop_graph","reason_code":"target_unavailable","when":{"input_id":"input:target","kind":"input_unavailable"}}],"success_condition":{"kind":"output_present","output_id":"output:review_report"},"tools":[],"validation":[{"configuration_member_id":null,"on_fail":"stop_graph","rule_id":"rule:review_has_evidence","validator_ref":{"digest":"sha256:274b90e8d398efa40fc2c12a1bc0b4a99ec24a694c689a269287d1b25558823e","name":"aci.schema-and-citation-validator","version":"1"}}]},{"agent":{"credential_ref":null,"display_name":"Dijkstra, Edsger W.","model_ref":{"digest":"sha256:951a0d328e2112a4598601c50024b75eeb9bffd06cbac9e593324567789d80f4","name":"gpt-5.6","version":"2026-09"},"profile_ref":{"digest":"sha256:f136048da6c4b36c93bfaba34b5e62d797703f4c4d37026159b2a0953065dac2","name":"aci.bounded-corrector","version":"1"},"provider_ref":{"digest":"sha256:6444659beabb3dbdf99bb59782d8b67035b779e175a8b83e6dfffba3722fdd63","name":"openai","version":"2026-09"},"role":"coder"},"inputs":[{"input_id":"input:target","required":true,"source":{"kind":"content_member","member_id":"member:result_x","selector":"$"}},{"input_id":"input:review_findings","required":true,"source":{"kind":"node_output","node_id":"node:review","output_id":"output:review_report"}}],"instructions":"Use o review_report como obrigação. Produza a correção mínima e registre como cada defeito foi tratado. Pare após validar localmente.","isolation":{"commands":{"grants":[],"mode":"deny"},"external_effects":{"allow":[],"mode":"deny"},"network":{"allow":[],"mode":"deny"},"read_paths":["workspace:/input","workspace:/target"],"version_control":{"commit":false,"push":false},"write_paths":["workspace:/target"]},"limits":{"max_attempts":2,"max_tokens":12000,"wall_clock_seconds":600},"node_id":"node:correct","objective":"Produzir uma correção limitada aos defeitos confirmados.","outputs":[{"output_id":"output:correction","required":true,"schema_member_id":"member:correction_schema"}],"start_when":"all_predecessors_succeeded","stop_conditions":[{"action":"fail_graph","reason_code":"correction_attempts_exhausted","when":{"kind":"attempts_exhausted"}},{"action":"stop_graph","reason_code":"target_unavailable","when":{"input_id":"input:target","kind":"input_unavailable"}}],"success_condition":{"kind":"output_present","output_id":"output:correction"},"tools":[{"allowed_operations":["read","patch"],"tool_ref":{"digest":"sha256:cf3e3a396e0496e01dcd7660e7b3237b387217751cda47d40109a993e9c430e8","name":"workspace.files","version":"1"}}],"validation":[{"configuration_member_id":"member:correction_schema","on_fail":"retry","rule_id":"rule:correction_contract","validator_ref":{"digest":"sha256:f016338fd2a0f7a423cce239a57300f26ba7150c3831a8690b2512298c4e8e04","name":"aci.schema-validator","version":"1"}}]},{"agent":{"credential_ref":null,"display_name":"Lamport, Leslie","model_ref":{"digest":"sha256:951a0d328e2112a4598601c50024b75eeb9bffd06cbac9e593324567789d80f4","name":"gpt-5.6","version":"2026-09"},"profile_ref":{"digest":"sha256:2db4735aba487bdd3db641e4500447a1577e3a4e26580da4105ab384e4a8b3c7","name":"aci.read-only-verifier","version":"1"},"provider_ref":{"digest":"sha256:6444659beabb3dbdf99bb59782d8b67035b779e175a8b83e6dfffba3722fdd63","name":"openai","version":"2026-09"},"role":"auditor"},"inputs":[{"input_id":"input:target","required":true,"source":{"kind":"content_member","member_id":"member:result_x","selector":"$"}},{"input_id":"input:review_findings","required":true,"source":{"kind":"node_output","node_id":"node:review","output_id":"output:review_report"}},{"input_id":"input:candidate_correction","required":true,"source":{"kind":"node_output","node_id":"node:correct","output_id":"output:correction"}}],"instructions":"Compare a correção com o review_report e o resultado original. Retorne pass, flag ou block com evidência. Não altere arquivos.","isolation":{"commands":{"grants":[],"mode":"deny"},"external_effects":{"allow":[],"mode":"deny"},"network":{"allow":[],"mode":"deny"},"read_paths":["workspace:/input","workspace:/target"],"version_control":{"commit":false,"push":false},"write_paths":[]},"limits":{"max_attempts":1,"max_tokens":6000,"wall_clock_seconds":300},"node_id":"node:verify","objective":"Verificar independentemente se a correção resolve os defeitos sem regressão.","outputs":[{"output_id":"output:verification","required":true,"schema_member_id":"member:verification_schema"}],"start_when":"all_predecessors_succeeded","stop_conditions":[{"action":"stop_graph","reason_code":"verification_flag","when":{"json_pointer":"/verdict","kind":"output_field_equals","output_id":"output:verification","value":"flag"}},{"action":"fail_graph","reason_code":"verification_block","when":{"json_pointer":"/verdict","kind":"output_field_equals","output_id":"output:verification","value":"block"}}],"success_condition":{"json_pointer":"/verdict","kind":"output_field_equals","output_id":"output:verification","value":"pass"},"tools":[{"allowed_operations":["read"],"tool_ref":{"digest":"sha256:cf3e3a396e0496e01dcd7660e7b3237b387217751cda47d40109a993e9c430e8","name":"workspace.files","version":"1"}}],"validation":[{"configuration_member_id":"member:verification_schema","on_fail":"stop_graph","rule_id":"rule:verification_evidence","validator_ref":{"digest":"sha256:d1d331d6b9186ff7abbbabdcdb48ae1a5f2dbae004f322c8a534fcb9c8ffe653","name":"aci.schema-and-evidence-validator","version":"1"}}]}],"objective":{"done_when":["A correção existe e a verificação independente retorna pass."],"statement":"Revisar o resultado X, produzir uma correção e verificar a correção."},"revision":"r1","schema":"aci.execution-graph@2","semantics_ref":{"digest":"sha256:40f3d717159e1d0eb77479d53474ff8f14f4bde7706edf42629a8f146a404fc7","name":"aci.execution-graph-semantics","version":"2"}}
